{
  "schema_version": "1.0",
  "principles": [
    "Stable discovery identity, executable composition, project instance, behavior evidence and release history have separate authorities.",
    "Every executable input and promotion artifact is immutable or content-addressed before a credentialed action consumes it.",
    "Pure validation and rendering remain separate from candidate execution and target credentials.",
    "Mutable deployment status is operational cache and never substitutes for append-only release evidence.",
    "New architecture kinds require a typed core change; providers and targets extend through constrained adapters.",
    "The CLI is a caller of components, not an additional source of catalog, policy or release truth."
  ],
  "components": [
    {
      "id": "catalog-registry",
      "responsibility": "Index stable Agent identities and resolve one active immutable Implementation for selection.",
      "capabilities": [
        "search-catalog",
        "resolve-implementation"
      ],
      "owns": [
        "catalog-index",
        "implementation-selection"
      ],
      "consumes": [
        "catalog-index"
      ],
      "produces": [
        "catalog-index",
        "implementation-selection"
      ],
      "credential_scope": "none",
      "storage_dependencies": [
        "version-control",
        "workspace"
      ],
      "extension_points": [],
      "forbidden_responsibilities": [
        "Execute implementation or evaluation code.",
        "Own Blueprint runtime, policy or lifecycle configuration.",
        "Deploy or record releases."
      ],
      "evidence_refs": [
        "agent-garden/discoverability-contract.md#Catalog Shape",
        "labs/10-agent-garden-discovery/garden_discovery/validation.py#validate_discovery_bundle"
      ]
    },
    {
      "id": "contract-validator",
      "responsibility": "Resolve immutable source and verify Catalog, Blueprint and cross-domain executable invariants.",
      "capabilities": [
        "catalog-resolution",
        "source-assurance",
        "local-reference",
        "single-agent-tools",
        "workflow-graph",
        "retrieval-provenance",
        "multi-agent-delegation",
        "approval-replay",
        "state-ownership",
        "common-policy-evaluation-lifecycle"
      ],
      "owns": [
        "validation-report"
      ],
      "consumes": [
        "implementation-selection",
        "blueprint",
        "implementation-source"
      ],
      "produces": [
        "validation-report"
      ],
      "credential_scope": "source-read",
      "storage_dependencies": [
        "version-control",
        "content-addressed-store"
      ],
      "extension_points": [
        "architecture-kind",
        "source-resolver"
      ],
      "forbidden_responsibilities": [
        "Mutate CatalogEntry or Blueprint authority.",
        "Render a project or resolve secret material.",
        "Execute a deployment."
      ],
      "evidence_refs": [
        "agent-garden/blueprint-schema.md#Semantic Validation",
        "labs/11-blueprint-schema/blueprint_lab/validation.py#validate_blueprint_bundle"
      ]
    },
    {
      "id": "project-renderer",
      "responsibility": "Purely render a validated Implementation and Blueprint into a regenerable Project Instance.",
      "capabilities": [
        "render-project-instance",
        "separate-secret-reference",
        "target-independent-render"
      ],
      "owns": [
        "project-instance"
      ],
      "consumes": [
        "blueprint",
        "implementation-source",
        "validation-report",
        "secret-reference"
      ],
      "produces": [
        "project-instance"
      ],
      "credential_scope": "none",
      "storage_dependencies": [
        "version-control",
        "workspace"
      ],
      "extension_points": [
        "scaffold-renderer",
        "runtime-service-binding"
      ],
      "forbidden_responsibilities": [
        "Resolve or persist secret material.",
        "Change Catalog, policy or evaluation authority.",
        "Build, deploy or promote a release."
      ],
      "evidence_refs": [
        "docs/production/production-engineering.md#Replaceable Ownership",
        "labs/08-production-engineering/production_lab/rendering.py#render_project"
      ]
    },
    {
      "id": "deployment-controller",
      "responsibility": "Build immutable candidates and execute target-specific stage, promote and rollback operations.",
      "capabilities": [
        "build-immutable-candidate",
        "stage-candidate",
        "promote-candidate",
        "execute-rollback"
      ],
      "owns": [
        "release-candidate",
        "deployment-status"
      ],
      "consumes": [
        "project-instance",
        "validation-report",
        "secret-reference",
        "release-candidate",
        "behavior-report",
        "rollback-plan"
      ],
      "produces": [
        "release-candidate",
        "deployment-status"
      ],
      "credential_scope": "target-scoped",
      "storage_dependencies": [
        "content-addressed-store",
        "target-control-plane",
        "external-secret-manager"
      ],
      "extension_points": [
        "deployment-target"
      ],
      "forbidden_responsibilities": [
        "Grade behavior or weaken blocking metric policy.",
        "Append or rewrite release history.",
        "Mutate CatalogEntry or Blueprint contracts."
      ],
      "evidence_refs": [
        "docs/production/production-engineering.md#Release and Rollback",
        "labs/08-production-engineering/production_lab/contracts.py#TargetProfile"
      ]
    },
    {
      "id": "behavior-gate",
      "responsibility": "Execute normalized traces and blocking metrics against the exact staged release candidate.",
      "capabilities": [
        "run-dataset",
        "grade-blocking-metrics",
        "emit-behavior-report"
      ],
      "owns": [
        "behavior-report"
      ],
      "consumes": [
        "release-candidate",
        "blueprint"
      ],
      "produces": [
        "behavior-report"
      ],
      "credential_scope": "sandboxed-execution",
      "storage_dependencies": [
        "content-addressed-store"
      ],
      "extension_points": [
        "evaluation-metric"
      ],
      "forbidden_responsibilities": [
        "Deploy or promote a candidate.",
        "Average away a requested blocking case failure.",
        "Append or modify release history."
      ],
      "evidence_refs": [
        "docs/evaluation/evaluation-engineering.md#CI Semantics",
        "labs/06-evaluation/evaluation_lab/engine.py#grade_trace_set"
      ]
    },
    {
      "id": "release-ledger",
      "responsibility": "Append immutable promotion evidence and derive rollback targets without target credentials.",
      "capabilities": [
        "append-release-record",
        "plan-rollback"
      ],
      "owns": [
        "release-record",
        "rollback-plan"
      ],
      "consumes": [
        "release-candidate",
        "behavior-report",
        "deployment-status",
        "release-record"
      ],
      "produces": [
        "release-record",
        "rollback-plan"
      ],
      "credential_scope": "ledger-write",
      "storage_dependencies": [
        "append-only-ledger",
        "workspace"
      ],
      "extension_points": [
        "release-store"
      ],
      "forbidden_responsibilities": [
        "Build or deploy an artifact.",
        "Store secret material or target credentials.",
        "Accept a failed behavior report or mutable candidate."
      ],
      "evidence_refs": [
        "docs/production/production-engineering.md#Release and Rollback",
        "labs/08-production-engineering/production_lab/release.py#ReleaseLedger"
      ]
    }
  ],
  "artifacts": [
    {
      "id": "catalog-index",
      "authority": "authoritative",
      "owner": "catalog-registry",
      "mutability": "mutable-index",
      "storage": "version-control",
      "digest_required": true,
      "secret_material_allowed": false,
      "producers": [
        "catalog-registry"
      ],
      "consumers": [
        "catalog-registry"
      ]
    },
    {
      "id": "implementation-selection",
      "authority": "derived",
      "owner": "catalog-registry",
      "mutability": "immutable",
      "storage": "workspace",
      "digest_required": true,
      "secret_material_allowed": false,
      "producers": [
        "catalog-registry"
      ],
      "consumers": [
        "contract-validator"
      ]
    },
    {
      "id": "blueprint",
      "authority": "authoritative",
      "owner": "external:agent-team",
      "mutability": "immutable",
      "storage": "version-control",
      "digest_required": true,
      "secret_material_allowed": false,
      "producers": [
        "external:agent-team"
      ],
      "consumers": [
        "contract-validator",
        "project-renderer",
        "behavior-gate"
      ]
    },
    {
      "id": "implementation-source",
      "authority": "authoritative",
      "owner": "external:agent-team",
      "mutability": "immutable",
      "storage": "version-control",
      "digest_required": true,
      "secret_material_allowed": false,
      "producers": [
        "external:agent-team"
      ],
      "consumers": [
        "contract-validator",
        "project-renderer"
      ]
    },
    {
      "id": "validation-report",
      "authority": "derived",
      "owner": "contract-validator",
      "mutability": "immutable",
      "storage": "content-addressed-store",
      "digest_required": true,
      "secret_material_allowed": false,
      "producers": [
        "contract-validator"
      ],
      "consumers": [
        "project-renderer",
        "deployment-controller"
      ]
    },
    {
      "id": "secret-reference",
      "authority": "external-reference",
      "owner": "external:secret-manager",
      "mutability": "immutable",